Handle,Title,Type,Tags,Option1 Name,Option1 Value
bagsmart-boxy-tote-bag-for-women-crossbody-bag-with-zipper-crush-bow-purses-for-travel-work-college,"BAGSMART Boxy Tote Bag for Women, Crossbody Bag with Zipper, Crush Bow Purses for Travel Work College",Handbag,bags,Title,Default Title
bagsmart-mini-backpack-for-women-lightweight-puffer-small-backpack-purse-quilted-casual-travel-daypack-cute-water-resistant-bookbag-for-daily-black,"BAGSMART Mini Backpack for Women, Lightweight Puffer Small Backpack Purse, Quilted Casual Travel Daypack, Cute Water-Resistant Bookbag for Daily, Black",Handbag,bags,Title,Default Title
bohunono-woven-clutch-purses-for-woman-summer-beach-purse-for-vacation-woven-striped-dumpling-bag-crochet-evening-handbag,"bohunono Woven Clutch Purses for Woman,Summer Beach Purse for Vacation, Woven Striped Dumpling Bag,Crochet Evening Handbag",Handbag,bags,Title,Default Title
travelon-anti-theft-heritage-small-crossbody-bag,Travelon Anti-Theft Heritage Small Crossbody Bag,Handbag,bags,Title,Default Title
banelu-small-sling-backpack-crossbody-bags-for-women-men-small-sling-bag-cross-body-bag-fanny-packs-crossbody-purses-black,"Banelu Small Sling Backpack Crossbody Bags for Women Men, Small Sling Bag Cross Body Bag Fanny Packs Crossbody Purses - Black",Handbag,bags,Title,Default Title
simple-modern-extra-large-beach-bag-waterproof-getaway-rubber-tote-with-zipper-pocket-for-travel-pool-boat-groceries-sports-blue-dune,"Simple Modern Extra-Large Beach Bag | Waterproof Getaway Rubber Tote with Zipper Pocket for Travel, Pool, Boat, Groceries, Sports | Blue Dune",Handbag,bags,Title,Default Title
montana-west-tote-bags-for-women-top-handle-satchel-purses,Montana West Tote Bags for Women Top Handle Satchel Purses,Handbag,bags,Title,Default Title
cookooky-straw-clutch-handbag-summer-beach-straw-purse-for-women-woven-envelope-bag-straw,COOKOOKY Straw Clutch Handbag Summer Beach Straw Purse for Women woven Envelope Bag | Straw,Handbag,bags,Title,Default Title
iioscre-beach-bag-for-women-causal-hobo-bag-with-zipper-inner-pocket-foldable-mesh-dive-duffle-bag-for-vacation-essentials,"Iioscre Beach Bag for Women, Causal Hobo Bag with Zipper Inner Pocket, Foldable Mesh Dive Duffle Bag for Vacation Essentials",Handbag,bags,Title,Default Title
black-and-white-checkered-crossbody-bag-bum-bag-for-women-spacious-checkered-purse-fanny-packs-belt-bag,"Black and White Checkered Crossbody Bag Bum Bag for Women,Spacious Checkered Purse Fanny Packs Belt Bag",Handbag,bags,Title,Default Title
airkit-small-wallet-women-rfid-blocking-soft-leather-bifold-compact-card-holder-wallet-for-women-with-zipper-coin-pocket-4-id-window,Airkit Small Wallet Women RFID Blocking Soft Leather Bifold Compact Card Holder Wallet for Women with Zipper Coin Pocket 4 ID Window,Handbag,bags,Title,Default Title
clear-bag-for-stadium-events-stadium-approved-small-mini-clear-purse-women-s-top-handle-handbags-for-sports-concerts,"Clear Bag for Stadium Events - Stadium Approved Small Mini Clear Purse, Women's Top-Handle Handbags for Sports Concerts",Handbag,bags,Title,Default Title
bagsmart-cross-body-purse-mini-crossbody-bags-for-women-travel-purse-puffy-shoulder-handbag-wallet-with-rfid-blocking-slots-black-small,"BAGSMART Cross Body Purse, Mini Crossbody Bags for Women Travel Purse, Puffy Shoulder Handbag Wallet with RFID Blocking Slots, Black-small",Handbag,bags,Title,Default Title
bs-vog-clear-purse-for-women-stadium-approved-small-crossbody-bag-with-zipper-clear-stadium-bag-for-concerts-sports,"BS-VOG Clear Purse for Women - Stadium Approved Small Crossbody Bag with Zipper, Clear Stadium Bag for Concerts, Sports",Handbag,bags,Title,Default Title
clear-purse-for-women-stadium-approved-crossbody-bag-small-stadium-bag-for-concerts-sports-events,"Clear Purse for Women - Stadium Approved Crossbody Bag, Small Stadium Bag for Concerts & Sports Events",Handbag,bags,Title,Default Title
fammart-iridescent-clear-beach-bags-waterproof-sandproof-for-women-large-jelly-tote-zipper-pool-bag-cruise-essentials-2026,"Fammart Iridescent Clear Beach Bags Waterproof Sandproof for Women, Large Jelly Tote Zipper Pool Bag Cruise Essentials 2026",Handbag,bags,Title,Default Title
toughergun-women-s-small-slim-leather-wallet-with-rfid-protection-compact-bifold-mini-purse-with-clear-id-window,"Toughergun Women’s Small Slim Leather Wallet with RFID Protection, Compact Bifold Mini Purse with Clear ID Window",Handbag,bags,Title,Default Title
fibrdoo-clear-crossbody-purse-bag-clear-bag-stadium-approved-with-front-pocket-for-concerts-sports-festivals,"Fibrdoo Clear Crossbody Purse Bag, Clear Bag Stadium Approved with Front Pocket for Concerts Sports Festivals",Handbag,bags,Title,Default Title
busiuw-clear-backpack-for-stadium-events-stadium-approved-clear-backpack-12x12x6-with-front-pocket-for-concert-sport-fashion-women-backpack-events-work-travel,Busiuw Clear Backpack for Stadium Events Stadium Approved Clear Backpack 12x12x6 with Front Pocket for Concert Sport Fashion Women Backpack Events Work Travel,Handbag,bags,Title,Default Title
fammart-mesh-beach-bag-with-zipper-for-women-large-beach-tote-sandproof-toys-pool-swim-bag-travel-vacation-cruise-essentials,"Fammart Mesh Beach Bag with Zipper for Women, Large Beach Tote Sandproof Toys Pool Swim Bag Travel Vacation Cruise Essentials",Handbag,bags,Title,Default Title
feiboon-spacious-checkered-nylon-crossbody-bag-bum-bag-handbags-wallets-for-women,FEIBOON Spacious Checkered Nylon Crossbody Bag Bum Bag Handbags Wallets for Women,Handbag,bags,Title,Default Title
janks-small-crossbody-bag-for-women-mini-phone-purses-with-crossbody-strap-and-wallet-nylon-arm-bag,JANKS Small Crossbody Bag for Women - Mini Phone Purses with Crossbody Strap and Wallet - Nylon Arm Bag,Handbag,bags,Title,Default Title
ginogento-stadium-approved-bags-for-women-shoulder-bags-pvc-purse-concert-bag,"Ginogento Stadium Approved Bags for Women -Shoulder Bags PVC Purse, Concert Bag",Handbag,bags,Title,Default Title
oraben-clear-bag-for-stadium-events-clear-purse-stadium-bag-satchel-handbags-for-sports-events-concerts-festivals-stadium-approved,Oraben Clear Bag for Stadium Events Clear Purse Stadium Bag Satchel Handbags for Sports Events Concerts Festivals | Stadium Approved,Handbag,bags,Title,Default Title
travelambo-rfid-wallet-women-bifold-multi-card-wallet-case-with-zipper-pocke-credit-card-holder-for-women,Travelambo RFID Wallet Women Bifold Multi Card Wallet Case with Zipper Pocke Credit Card Holder for Women,Handbag,bags,Title,Default Title
coowoz-travel-backpack-for-women-men-carry-on-backpack-hiking-backpack-waterproof-outdoor-sports-rucksack-casual-daypack-travel-essentials-olive-green,"coowoz Travel Backpack For Women Men,Carry On Backpack,Hiking Backpack Waterproof Outdoor Sports Rucksack Casual Daypack Travel Essentials(Olive Green)",Handbag,bags,Title,Default Title
aphison-trendy-leather-crossbody-purse-with-adjustable-strap-women-s-shoulder-handbag,"APHISON Trendy Leather Crossbody Purse with Adjustable Strap, Women's Shoulder Handbag",Handbag,bags,Title,Default Title
cluci-clear-bag-for-stadium-events-clear-crossbody-bag-transparent-purses,"CLUCI Clear Bag for Stadium Events, Clear Crossbody Bag, Transparent Purses",Handbag,bags,Title,Default Title
mum-s-memory-mini-zip-around-wristlet-wallets-for-women-keychain-wallet-with-detachable-dual-pouch-wristlet-key-chain-coin-purse-small-wallets,Mum's Memory Mini Zip Around Wristlet Wallets for Women -KeyChain Wallet with Detachable Dual Pouch Wristlet -Key Chain Coin Purse Small Wallets,Handbag,bags,Title,Default Title
lorbro-clear-purse-for-women-stadium-approved-clear-crossbody-bag-with-zipper-closure-transparent-purse-for-concert-sports,"Lorbro Clear Purse for Women Stadium Approved, Clear Crossbody Bag with Zipper Closure, Transparent Purse for Concert Sports",Handbag,bags,Title,Default Title
giancomics-sea-turtle-womens-wallet-rfid-blocking-credit-card-holder-bifold-pu-leather-travel-billfold-long-cute-cash-purse-zipper-coin-pocket-clutch-1-id-window-11-card-slot-ladies-gift-woman,"GIANCOMICS Sea Turtle Womens Wallet RFID Blocking, Credit Card Holder Bifold, PU Leather Travel Billfold, Long Cute Cash Purse, Zipper Coin Pocket Clutch, 1 ID Window, 11 Card Slot, Ladies Gift Woman",Handbag,bags,Title,Default Title
jogjam-black-cat-floral-rfid-women-wallet-small-slim-thin-credit-card-wallet-pu-leather-bifold-cash-zipper-coin-pocket-id-window-for-female-ladies-teen-girls-girly,"Jogjam Black Cat Floral Rfid Women Wallet, Small Slim Thin Credit Card Wallet, PU Leather Bifold Cash Zipper Coin Pocket ID Window for Female Ladies Teen Girls Girly",Handbag,bags,Title,Default Title
kalidi-women-corduroy-tote-bag-zipper-casual-tote-s-handbag-big-capacity-shoulder-bag-with-pockets,KALIDI Women Corduroy Tote Bag Zipper Casual Tote's Handbag Big Capacity Shoulder Bag with Pockets,Handbag,bags,Title,Default Title
cookooky-womens-straw-clutch-bag-bohemian-summer-beach-straw-purse-zipper-wristlet-wallets-for-women,COOKOOKY Womens Straw Clutch Bag Bohemian Summer Beach Straw Purse Zipper Wristlet Wallets for Women,Handbag,bags,Title,Default Title
tobvzoo-clear-bag-stadium-approved-crossbody-transparent-bag-for-concerts-sports-events-purses-for-men-women,"TOBVZOO Clear Bag Stadium Approved, Crossbody Transparent Bag for Concerts Sports Events, Purses for Men & Women",Handbag,bags,Title,Default Title
coach-women-s-plaza-bag-18,Coach Women’s Plaza Bag 18,Handbag,bags,Title,Default Title
ketiee-clear-crossbody-bag-stadium-approved-clear-purse-bag-for-concerts-sports-events-festivals,"KETIEE Clear Crossbody Bag, Stadium Approved Clear Purse Bag for Concerts Sports Events Festivals",Handbag,bags,Title,Default Title
befen-genuine-leather-crossbody-bags-for-women-cell-phone-cross-body-purse-bag-with-rfid-blocking-card-slots,"befen Genuine Leather Crossbody Bags for Women, Cell Phone Cross body Purse Bag with RFID Blocking Card Slots",Handbag,bags,Title,Default Title
vantamo-crescent-bags-for-women-with-rfid-protection-half-moon-clutch-purses-for-women-with-anti-theft-clip-for-extra-safety,"Vantamo Crescent Bags For Women with RFID Protection, Half Moon Clutch Purses for Women with Anti-Theft Clip for Extra Safety",Handbag,bags,Title,Default Title
mexs-small-crossbody-bags-for-women-mini-casual-cross-body-bag-travel-purse-adjustable-strap-shoulder-handbags-wallet,"MEXS Small Crossbody Bags for Women, Mini Casual Cross Body Bag Travel Purse, Adjustable Strap Shoulder Handbags Wallet",Handbag,bags,Title,Default Title
inicat-women-s-small-sling-bag-lightweight-everyday-vegan-leather-crossbody-purse-for-daily-essentials-and-travel-light,"INICAT Women's Small Sling Bag, Lightweight Everyday Vegan Leather Crossbody Purse for Daily Essentials and Travel Light",Handbag,bags,Title,Default Title
latmap-clear-bag-for-stadium-events-clear-purse-for-women-stadium-crossbody-bag-transparent-bag-for-concerts-sports,"LATMAP Clear Bag for Stadium Events, Clear Purse for Women Stadium Crossbody Bag, Transparent Bag for Concerts Sports",Handbag,bags,Title,Default Title
joryin-woven-women-s-crossbody-bag-evening-purse-trendy-dumpling-clutch-hobo-cloud-shoulder-bag-trendy-dumpling-clutch,"Joryin Woven Women's Crossbody Bag & Evening Purse, Trendy Dumpling Clutch & Hobo Cloud Shoulder Bag Trendy Dumpling Clutch",Handbag,bags,Title,Default Title
fodoko-wristlet-wallets-for-women-nylon-quilted-wallet-with-4-zippers-travel-credit-card-holder-cell-phone-organizer,"FODOKO Wristlet wallets for women Nylon Quilted Wallet with 4 Zippers,Travel Credit Card,Holder Cell Phone Organizer",Handbag,bags,Title,Default Title
womens-t-shirts-v-neck-dragonfly-tee-cute-summer-graphic-shirts-vintage-boho-flowers-short-sleeve-t-shirt,Women's T-Shirts V-Neck Dragonfly Tee Cute Summer Graphic Shirts Vintage Boho Flowers Short Sleeve T Shirt,Apparel,clothing,Title,Default Title
anrabess-womens-short-sleeve-henley-tops-v-neck-dressy-casual-blouses-summer-trendy-tee-shirts-2026-vacation-fashion-clothes,ANRABESS Womens Short Sleeve Henley Tops V Neck Dressy Casual Blouses Summer Trendy Tee Shirts 2026 Vacation Fashion Clothes,Apparel,clothing,Title,Default Title
chicme-women-built-in-bra-tank-tops-sleeveless-casual-shirts-racerback-ribbed-fitted-tank-tops,CHICME Women Built-in Bra Tank Tops Sleeveless Casual Shirts Racerback Ribbed Fitted Tank Tops,Apparel,clothing,Title,Default Title
zeagoo-womens-tank-tops-summer-sleeveless-loose-fit-tops-v-neck-pleated-shirts-basic-tees-dressy-casual-trendy-clothes,Zeagoo Womens Tank Tops Summer Sleeveless Loose Fit Tops V Neck Pleated Shirts Basic Tees Dressy Casual Trendy Clothes,Apparel,clothing,Title,Default Title
trendy-queen-womens-strapless-bandeau-crop-top,Trendy Queen Women's Strapless Bandeau Crop Top,Apparel,clothing,Title,Default Title
oversized-tshirts-for-men-short-sleeve-vintage-washed-basic-loose-tees-2026,Oversized Tshirts for Men Short Sleeve Vintage Washed Basic Loose Tees 2026,Apparel,clothing,Title,Default Title
letsjoli-bras-for-women-supportive-wireless-push-up-bra-full-coverage-no-underwire-seamless-plus-size-for-older-women,LetsJoli Bras for Women Supportive Wireless Push Up Bra Full Coverage No Underwire Seamless Plus Size for Older Women,Apparel,clothing,Title,Default Title
oeak-womens-deep-v-bras-wireless-comfortable-bra-supportive-no-underwire-bras-tshirt-push-up-bralettes-plunge-seamless-bra,OEAK Womens Deep V Bras Wireless Comfortable Bra Supportive No Underwire Bras Tshirt Push Up Bralettes Plunge Seamless Bra,Apparel,clothing,Title,Default Title
nippies-nipple-covers-for-women-reusable-sticky-silicone-pasties-with-travel-case-original-circle-or-lift-style-available,Nippies Nipple Covers for Women - Reusable Sticky Silicone Pasties with Travel Case - Original Circle or Lift Style Available,Apparel,clothing,Title,Default Title
sampeel-wide-leg-pants-for-women-flowy-palazzo-drawstring-elastic-waist-trousers-with-pockets-summer-beach-vacation-clothes,Sampeel Wide Leg Pants for Women Flowy Palazzo Drawstring Elastic Waist Trousers with Pockets Summer Beach Vacation Clothes,Apparel,clothing,Title,Default Title
gildan-adult-ultra-cotton-t-shirt-style-g2000-multipack,"Gildan Adult Ultra Cotton T-Shirt, Style G2000, Multipack",Apparel,clothing,Title,Default Title
leafigure-2-pack-womens-biker-shorts-with-pockets-high-waisted-tummy-control-yoga-shorts-for-women-running-gym-and-workout,"Leafigure 2 Pack Womens Biker Shorts with Pockets, High Waisted Tummy Control Yoga Shorts for Women Running Gym and Workout",Apparel,clothing,Title,Default Title
bmjl-women-s-athletic-shorts-high-waisted-running-short-pocket-2-5-sporty-shorts-gym-workout-shorts,"BMJL Women's Athletic Shorts High Waisted Running Short Pocket 2.5"" Sporty Shorts Gym Workout Shorts",Apparel,clothing,Title,Default Title
anrabess-women-athletic-dress-summer-tennis-workout-active-sports-mini-romper-dress-built-in-shorts-travel-vacation-clothes,ANRABESS Women Athletic Dress Summer Tennis Workout Active Sports Mini Romper Dress Built in Shorts Travel Vacation Clothes,Apparel,clothing,Title,Default Title
oeak-womens-wireless-jelly-bra-plus-size-supportive-seamless-bras-full-coverage-push-up-comfortable-no-underwire-tshirt-bras,OEAK Womens Wireless Jelly Bra Plus Size Supportive Seamless Bras Full Coverage Push Up Comfortable No Underwire Tshirt Bras,Apparel,clothing,Title,Default Title
letsjoli-push-up-strapless-bras-for-women-supportive-bandeau-bra-non-slip-wireless-no-underwire-padded-tube-bra,LetsJoli Push Up Strapless Bras for Women Supportive Bandeau Bra Non Slip Wireless No Underwire Padded Tube Bra,Apparel,clothing,Title,Default Title
cocomarts-jelly-bras-for-women-no-underwire-scalloped-push-up-wireless-bralettes-seamless-soft-comfort-everyday-tshirt-bra,COCOMARTS Jelly Bras for Women No Underwire Scalloped Push Up Wireless Bralettes Seamless Soft Comfort Everyday Tshirt Bra,Apparel,clothing,Title,Default Title
hanes-women-s-underwear-pack-10-pack-full-coverage-cotton-blend-panties-moisture-wicking-underwear-for-women,"Hanes Women's Underwear Pack, 10-Pack, Full-Coverage Cotton Blend Panties, Moisture-Wicking Underwear for Women",Apparel,clothing,Title,Default Title
holipick-women-tummy-control-one-piece-swimsuit-push-up-bathing-suit-full-coverage-slimming-swimwear,Holipick Women Tummy Control One Piece Swimsuit - Push Up Bathing Suit Full Coverage Slimming Swimwear,Apparel,clothing,Title,Default Title
shapermint-strapless-bra-wireless-non-slip-bandeau-convertible-straps-molded-strapless-bras-for-women-s-to-large-breasts,"SHAPERMINT Strapless Bra, Wireless Non-Slip Bandeau, Convertible Straps, Molded Strapless Bras for Women S to Large Breasts",Apparel,clothing,Title,Default Title
women-s-sun-shirts-upf-50-long-sleeve-uv-protection-shirt-lightweight-quick-dry-workout-hiking-tops-for-women,Women's Sun Shirts UPF 50+ Long Sleeve UV Protection Shirt Lightweight Quick Dry Workout Hiking Tops for Women,Apparel,clothing,Title,Default Title
anrabess-boxer-shorts-for-women-gingham-pajama-2026-summer-casual-lounge-sleep-plaid-shorts-y2k-beach-bottoms,ANRABESS Boxer Shorts for Women Gingham Pajama 2026 Summer Casual Lounge Sleep Plaid Shorts Y2K Beach Bottoms,Apparel,clothing,Title,Default Title
automet-womens-square-neck-tank-tops-loose-fit-2026-summer-tops-clothes-fashion,AUTOMET Womens Square Neck Tank Tops Loose Fit 2026 Summer Tops Clothes Fashion,Apparel,clothing,Title,Default Title
levi-s-women-s-501-original-shorts-also-available-in-plus,Levi's Women's 501 Original Shorts (Also Available in Plus),Apparel,clothing,Title,Default Title
summer-mae-blouson-tankini-swimsuits-for-women-2026-tummy-control-two-piece-bathing-suits-with-sporty-pockets-swim-shorts,Summer Mae Blouson Tankini Swimsuits for Women 2026 Tummy Control Two Piece Bathing Suits with Sporty Pockets Swim Shorts,Apparel,clothing,Title,Default Title
sinophant-high-waisted-leggings-for-women-full-length-capri-buttery-soft-yoga-pants-for-workout-athletic,SINOPHANT High Waisted Leggings for Women - Full Length Capri Buttery Soft Yoga Pants for Workout Athletic,Apparel,clothing,Title,Default Title
women-s-sexy-american-flag-crop-tank-4th-of-july-patriotic-sleeveless-tee-tops,Women's Sexy American Flag Crop Tank 4th of July Patriotic Sleeveless Tee Tops,Apparel,clothing,Title,Default Title
anrabess-womens-sleeveless-high-neck-tank-tops-fashion-summer-casual-basic-slim-fit-ribbed-racerback-top-shirt-clothes,ANRABESS Womens Sleeveless High Neck Tank Tops Fashion Summer Casual Basic Slim Fit Ribbed Racerback Top Shirt Clothes,Apparel,clothing,Title,Default Title
vertvie-jelly-bras-for-women-plus-size-minimizer-soft-wireless-push-up-bra-full-supportive-older-lift-back-coverage-bralette,Vertvie Jelly Bras for Women Plus Size Minimizer Soft Wireless Push Up Bra Full Supportive Older Lift Back Coverage Bralette,Apparel,clothing,Title,Default Title
molasus-women-s-cotton-underwear-high-waisted-full-coverage-ladies-panties-regular-plus-size,Molasus Women's Cotton Underwear High Waisted Full Coverage Ladies Panties (Regular & Plus Size),Apparel,clothing,Title,Default Title
fitrell-3-pairs-compression-socks-for-women-and-men-20-30mmhg-circulation-support-socks,FITRELL 3 Pairs Compression Socks for Women and Men 20-30mmHg-Circulation Support Socks,Apparel,clothing,Title,Default Title
anrabess-womens-sleeveless-scoop-neck-tank-top-ribbed-fitted-summer-basic-slim-cute-tops-2026,ANRABESS Womens Sleeveless Scoop Neck Tank Top Ribbed Fitted Summer Basic Slim Cute Tops 2026,Apparel,clothing,Title,Default Title
zeagoo-womens-tops-short-sleeve-v-neck-tee-shirts-cute-dressy-casual-clothing-business-work-blouse,Zeagoo Womens Tops Short Sleeve V Neck Tee Shirts Cute Dressy Casual Clothing Business Work Blouse,Apparel,clothing,Title,Default Title
voenxe-seamless-women-underwear-thongs-no-show-ladies-thong-no-line-workout-breathable-comfortable-panties-soft-undies-5-pack,"voenxe Seamless Women Underwear Thongs,No Show Ladies Thong,No Line Workout Breathable Comfortable Panties,Soft Undies,5-Pack",Apparel,clothing,Title,Default Title
anrabess-tank-tops-for-women-v-neck-ribbed-knit-slim-fitted-sleeveless-basic-tee-tanks-casual-summer-clothes-2026,ANRABESS Tank Tops for Women V Neck Ribbed Knit Slim Fitted Sleeveless Basic Tee Tanks Casual Summer Clothes 2026,Apparel,clothing,Title,Default Title
wiholl-summer-dresses-for-women-flowy-casual-midi-dress-beach-vacation-sundresses-with-pockets,WIHOLL Summer Dresses for Women Flowy Casual Midi Dress Beach Vacation Sundresses with Pockets,Apparel,clothing,Title,Default Title
niidor-adhesive-bra-strapless-ultra-sticky-invisible-push-up-silicone-bra-multiple-colors-sizes-reusable-for-backless-dress,Niidor Adhesive Bra Strapless Ultra Sticky Invisible Push up Silicone Bra Multiple Colors Sizes Reusable for Backless Dress,Apparel,clothing,Title,Default Title
amazon-essentials-women-s-cotton-spandex-bikini-brief-underwear-available-in-plus-size-pack-of-6,"Amazon Essentials Women's Cotton Spandex Bikini Brief Underwear (Available in Plus Size), Pack of 6",Apparel,clothing,Title,Default Title
herseas-women-s-tie-shoulder-bikini-sets-2-piece-striped-swimsuits-high-waisted-bathing-suits,Herseas Women's Tie Shoulder Bikini Sets 2 Piece Striped Swimsuits High Waisted Bathing Suits,Apparel,clothing,Title,Default Title
baleaf-women-s-8-5-3-biker-shorts-high-waist-yoga-workout-gym-running-volleyball-spandex-shorts-with-pockets,"baleaf Women's 8""/ 5""/ 3"" Biker Shorts High Waist Yoga Workout Gym Running Volleyball Spandex Shorts with Pockets",Apparel,clothing,Title,Default Title
sinophant-high-waisted-leggings-with-pockets-women-full-length-capri-buttery-soft-stretchy-yoga-pants,"SINOPHANT High Waisted Leggings with Pockets Women, Full Length Capri Buttery Soft Stretchy Yoga Pants",Apparel,clothing,Title,Default Title
holipick-3-piece-tankini-swimsuits-for-women-tummy-control-bathing-suits-swim-tank-top-with-bra-boy-shorts-teen-swimwear-2026,Holipick 3 Piece Tankini Swimsuits for Women Tummy Control Bathing Suits Swim Tank Top with Bra Boy Shorts Teen Swimwear 2026,Apparel,clothing,Title,Default Title
campsnail-biker-shorts-women-with-pockets-3-5-8-high-waisted-workout-spandex-tummy-control-gym-running-yoga-shorts,"CAMPSNAIL Biker Shorts Women with Pockets - 3""/5""/8"" High Waisted Workout Spandex Tummy Control Gym Running Yoga Shorts",Apparel,clothing,Title,Default Title
magcomsen-women-s-long-sleeve-shirts-upf-50-sun-protection-shirts-for-hiking-fishing-workout-rash-guard,MAGCOMSEN Women's Long Sleeve Shirts UPF 50+ Sun Protection Shirts for Hiking Fishing Workout Rash Guard,Apparel,clothing,Title,Default Title
lentta-womens-athletic-sleeveless-mini-dress-with-built-in-shorts-v-neck-spaghetti-strap-sundress,Lentta Womens Athletic Sleeveless Mini Dress with Built-in Shorts V Neck Spaghetti Strap Sundress,Apparel,clothing,Title,Default Title
eomenie-women-s-one-piece-swimsuits-tummy-control-cutout-high-waisted-bathing-suit-wrap-tie-back-1-piece-swimsuit,Eomenie Women's One Piece Swimsuits Tummy Control Cutout High Waisted Bathing Suit Wrap Tie Back 1 Piece Swimsuit,Apparel,clothing,Title,Default Title
danysu-v-neck-cotton-tank-tops-with-built-in-shelf-bra-sleeveless-racerback-fitted-basic-cami-shirts,Danysu V Neck Cotton Tank Tops with Built-in Shelf Bra Sleeveless Racerback Fitted Basic Cami Shirts,Apparel,clothing,Title,Default Title
wiholl-womens-summer-t-shirts-short-sleeve-v-neck-dolman-tops-with-side-shirring-loose-fit-shirts-spring-fashion,WIHOLL Womens Summer T-Shirts Short Sleeve V Neck Dolman Tops with Side Shirring Loose Fit Shirts Spring Fashion,Apparel,clothing,Title,Default Title
boho-floral-racerback-tank-tops-for-women-american-flag-shirt-summer-sleeveless-graphic-tanks-vest-cute-mama-tank-cami,Boho Floral Racerback Tank Tops for Women American Flag Shirt Summer Sleeveless Graphic Tanks Vest Cute Mama Tank Cami,Apparel,clothing,Title,Default Title
shapermint-shapewear-for-women-high-waisted-shapewear-tummy-control-shorts-thigh-slimmer-underwear-for-women,"SHAPERMINT Shapewear for Women - High-Waisted Shapewear Tummy Control Shorts, Thigh Slimmer, Underwear for Women",Apparel,clothing,Title,Default Title
eomenie-one-piece-swimdress-swimsuits-for-women-tummy-control-swim-dresses-skirt-bathing-suit,Eomenie One Piece Swimdress Swimsuits for Women Tummy Control Swim Dresses Skirt Bathing Suit,Apparel,clothing,Title,Default Title
blooming-jelly-women-one-piece-swim-dress-tummy-control-swimsuits-slimming-mesh-sheer-sarong-wraps-bathing-suit,Blooming Jelly Women One Piece Swim Dress Tummy Control Swimsuits Slimming Mesh Sheer Sarong Wraps Bathing Suit,Apparel,clothing,Title,Default Title
yeoreo-ease-workout-leggings-womens-no-front-seam-straight-leggings-29-31-5-33-35-high-waist-buttery-eddiy-yoga-pants,"YEOREO Ease Workout Leggings Womens No Front Seam Straight Leggings 29""/ 31.5""/ 33""/ 35"" High Waist Buttery Eddiy Yoga Pants",Apparel,clothing,Title,Default Title
trendy-queen-women-s-strapless-bandeau-crop-top,Trendy Queen Women's Strapless Bandeau Crop Top,Apparel,clothing,Title,Default Title
danysu-v-neck-racer-back-tank-top-for-women-padded-ribbed-long-tank-fitted-basic-cami-tops,Danysu V Neck Racer Back Tank Top for Women Padded Ribbed Long Tank Fitted Basic Cami Tops,Apparel,clothing,Title,Default Title
women-s-t-shirts-v-neck-dragonfly-tee-cute-summer-graphic-shirts-vintage-boho-flowers-short-sleeve-t-shirt,Women's T-Shirts V-Neck Dragonfly Tee Cute Summer Graphic Shirts Vintage Boho Flowers Short Sleeve T Shirt,Apparel,clothing,Title,Default Title
ekouaer-pajama-set-for-women-2-piece-lounge-set-short-sleeve-tops-and-shorts-soft-sleepwear-chest-pocket,"Ekouaer Pajama Set for Women 2 Piece Lounge Set Short Sleeve Tops and Shorts Soft Sleepwear, Chest Pocket",Apparel,clothing,Title,Default Title
