Handle,Title,Type,Tags,Option1 Name,Option1 Value
skechers-women-s-bobs-b-cute-sneaker-memory-foam-flexible-outsole-lightweight-vegan-shoes,"Skechers Women's Bobs B Cute Sneaker - Memory Foam, Flexible Outsole, Lightweight Vegan Shoes",Shoes,shoes,Title,Default Title
weweya-slides-for-women-and-men-bathroom-shower-shoes-non-slip-house-slippers-lightweight-beach-sandals,Weweya Slides for Women and Men - Bathroom Shower Shoes - Non Slip House Slippers - Lightweight Beach Sandals,Shoes,shoes,Title,Default Title
brooks-women-s-revel-8-neutral-running-walking-shoe,Brooks Women’s Revel 8 Neutral Running & Walking Shoe,Shoes,shoes,Title,Default Title
watelves-water-shoes-mens-womens-beach-swim-shoes-quick-dry-aqua-socks-pool-shoes-for-surf-yoga-water-aerobics,WateLves Water Shoes Mens Womens Beach Swim Shoes Quick-Dry Aqua Socks Pool Shoes for Surf Yoga Water Aerobics,Shoes,shoes,Title,Default Title
snug-leaves-women-s-fuzzy-scuff-slippers-soft-comfy-memory-foam-non-slip-indoor-house-shoes,Snug Leaves Women's Fuzzy Scuff Slippers Soft Comfy Memory Foam Non-slip Indoor House Shoes,Shoes,shoes,Title,Default Title
dr-scholl-s-shoes-women-s-time-off,Dr.Scholl's Shoes Women's Time Off,Shoes,shoes,Title,Default Title
coface-womens-fashion-orthotic-flip-flops-ladies-slip-on-lightweight-athletic-yoga-mat-cushion-thong-sandals-with-comfortable-plantar-fasciitis-arch-support,COFACE Womens Fashion Orthotic Flip Flops Ladies Slip On Lightweight Athletic Yoga Mat Cushion Thong Sandals With Comfortable Plantar Fasciitis Arch Support,Shoes,shoes,Title,Default Title
litfun-shower-shoes-for-women-non-slip-quick-dry-shower-slippers-lightweight-pool-sandals-with-drain-holes-for-college-dorm-beach-bathroom-gym,"Litfun Shower Shoes for Women Non-Slip Quick Dry Shower Slippers Lightweight Pool Sandals with Drain Holes for College Dorm, Beach, Bathroom & Gym",Shoes,shoes,Title,Default Title
vsufim-quick-dry-water-sports-barefoot-shoes-aqua-socks-for-swim-beach-pool-surf-yoga-for-women-men,Vsufim Quick-Dry Water Sports Barefoot Shoes Aqua Socks for Swim Beach Pool Surf Yoga for Women Men,Shoes,shoes,Title,Default Title
