Handle,Title,Type,Tags,Option1 Name,Option1 Value
chunky-gold-bangle-bracelets-for-women-dainty-14k-gold-plated-big-stackable-bangles-set-trendy-statement-cuff-bracelet-stack-fashion-jewelry-gifts,"Chunky Gold Bangle Bracelets for Women, Dainty 14k Gold Plated Big Stackable Bangles Set, Trendy Statement Cuff Bracelet Stack Fashion Jewelry Gifts",Jewelry,jewelry,Title,Default Title
womengifts-layered-gold-necklaces-for-women-14k-gold-sterling-silver-plated-dainty-pendant-necklace-set-non-tarnish-chunky-stackable-cuban-chain-choker-trendy-birthstone-vacation-jewelry-gift,"WomenGifts Layered Gold Necklaces for Women, 14K Gold Sterling Silver Plated Dainty Pendant Necklace Set Non Tarnish, Chunky Stackable Cuban Chain Choker, Trendy Birthstone Vacation Jewelry Gift",Jewelry,jewelry,Title,Default Title
freekiss-3-pairs-gold-hoop-earrings-set-dainty-stud-earrings-trendy-small-14k-gold-plated-hypoallergenic-dangle-cartilage-huggie-hoop-earrings-for-women-gold-jewelry-for-women-gifts,Freekiss 3 Pairs Gold Hoop Earrings Set: Dainty Stud Earrings Trendy Small 14K Gold Plated Hypoallergenic Dangle Cartilage Huggie Hoop Earrings for Women Gold Jewelry for Women Gifts,Jewelry,jewelry,Title,Default Title
gold-ankle-bracelets-for-women-waterproof-dainty-gold-anklets-trendy-layered-14k-gold-silver-plated-stackable-chunky-cuban-link-chian-anklet-bracelet-set-for-women-non-tarnish-beach-jewelry-gift,Gold Ankle Bracelets for Women Waterproof - Dainty Gold Anklets Trendy Layered 14K Gold/Silver Plated Stackable Chunky Cuban Link Chian Anklet Bracelet Set for Women Non Tarnish Beach Jewelry Gift,Jewelry,jewelry,Title,Default Title
3pairs-gold-hoop-earrings-set-for-women-trendy-chunky-huggie-dainty-earring-jewelry-for-women-teens,3Pairs Gold Hoop Earrings Set for Women Trendy Chunky Huggie Dainty Earring Jewelry for Women Teens,Jewelry,jewelry,Title,Default Title
gokeey-ankle-bracelets-for-women-waterproof-14k-gold-plated-jewelry-set-layered-cuban-figaro-link-chain-anklets-set-gold-anklets-summer-boho-beach-jewelry-gift-adjustable-size,"Gokeey Ankle Bracelets for Women Waterproof, 14k Gold Plated Jewelry Set Layered Cuban Figaro Link Chain Anklets Set Gold Anklets Summer Boho Beach Jewelry Gift Adjustable Size",Jewelry,jewelry,Title,Default Title
non-tarnish-gold-chunky-rings-for-women-14k-gold-plated-statement-dome-rings-stacking-silver-adjustable-mens-eternity-wedding-band-mixed-metal-jewelry-size-3-13,"Non Tarnish Gold Chunky Rings for Women, 14K Gold Plated Statement Dome Rings Stacking Silver, Adjustable Mens Eternity Wedding Band Mixed Metal Jewelry Size 3-13",Jewelry,jewelry,Title,Default Title
gacimy-gold-hoop-earrings-for-women-14k-real-gold-plated-hoops-with-925-sterling-silver-post,Gacimy Gold Hoop Earrings for Women 14K Real Gold Plated Hoops with 925 Sterling Silver Post,Jewelry,jewelry,Title,Default Title
pavoi-14k-gold-plated-cubic-zirconia-cross-necklace-for-women-cross-faith-pendant-necklaces,PAVOI 14K Gold Plated Cubic Zirconia Cross Necklace for Women | Cross Faith Pendant Necklaces,Jewelry,jewelry,Title,Default Title
fesciory-leather-wrap-bracelets-for-women-boho-leopard-multi-layer-crystal-beads-cuff-bracelet-jewelry,"Fesciory Leather Wrap Bracelets for Women, Boho Leopard Multi-Layer Crystal Beads Cuff Bracelet Jewelry",Jewelry,jewelry,Title,Default Title
jewlpire-18k-gold-plated-925-sterling-silver-chain-necklace-for-women-1-1mm-cable-chains-necklace-thin-dainty-sturdy-womens-chain-necklaces-14-16-17-18-20-22-24-inches,"Jewlpire 18k Gold Plated 925 Sterling Silver Chain Necklace for Women, 1.1mm Cable Chains Necklace Thin & Dainty & Sturdy Women's Chain Necklaces, 14/16/17/18/20/22/24 Inches",Jewelry,jewelry,Title,Default Title
gacimy-gold-hoop-earrings-for-women-14k-gold-plated-925-sterling-silver-post-hypoallergenic-earrings-hoops-for-women,"Gacimy Gold Hoop Earrings for Women 14K Gold Plated, 925 Sterling Silver Post Hypoallergenic Earrings Hoops for Women",Jewelry,jewelry,Title,Default Title
if-you-gold-ankle-bracelets-for-women-14k-gold-plated-waterproof-cuban-link-chain-anklets-set-layered-anklet-bracelets-for-women-beach-gift-adjustable-size-5pcs,"iF YOU Gold Ankle Bracelets for Women, 14k Gold Plated Waterproof Cuban Link Chain Anklets Set, Layered Anklet Bracelets for Women Beach Gift Adjustable Size 5pcs",Jewelry,jewelry,Title,Default Title
4-pairs-silver-gold-hoop-earrings-for-women-14k-gold-plated-hoop-earrings-set-hypoallergenic-earring-lightweight-dangle-earrings-set,4 Pairs Silver Gold Hoop Earrings for Women | 14K Gold Plated Hoop Earrings Set Hypoallergenic Earring Lightweight Dangle Earrings Set,Jewelry,jewelry,Title,Default Title
qceasiy-shell-ankle-bracelet-set-for-women-gold-plated-boho-bead-adjustable-anklet-hawaiian-beach-seashell-pearl-heart-starfish-conch-foot-jewelry-gifts,"Qceasiy Shell Ankle Bracelet Set for Women, Gold Plated Boho Bead Adjustable Anklet, Hawaiian Beach Seashell Pearl Heart Starfish Conch Foot Jewelry Gifts",Jewelry,jewelry,Title,Default Title
lilie-white-resin-chunky-beaded-necklace-for-women-minimalistic-modern-statement-necklace-jewelry-accessories,LILIE&WHITE Resin Chunky Beaded Necklace for Women Minimalistic Modern Statement Necklace Jewelry Accessories,Jewelry,jewelry,Title,Default Title
cueziy-dainty-silver-gold-necklaces-for-women-cute-station-choker-simulated-diamond-necklace-simple-layering-cz-necklace-trendy-jewelry-gifts,CUEZIY Dainty Silver Gold Necklaces for Women Cute Station Choker Simulated Diamond Necklace Simple Layering CZ Necklace Trendy Jewelry Gifts,Jewelry,jewelry,Title,Default Title
dangle-flower-earrings-for-women-statement-trendy-hoop-earring-floral-drop-earrings-jewelry,Dangle Flower Earrings for Women Statement Trendy Hoop Earring Floral Drop Earrings Jewelry,Jewelry,jewelry,Title,Default Title
3pcs-14k-gold-plated-hand-chain-bracelets-for-women-stack-bracelets-set-adjustable-trendy-dainty-ring-bracelet-hand-chain,"3PCS 14K Gold-Plated Hand Chain Bracelets for Women, Stack Bracelets Set Adjustable, Trendy Dainty Ring Bracelet Hand Chain",Jewelry,jewelry,Title,Default Title
2-3-pcs-gold-anklets-for-women-waterproof-cuban-link-anklet-beaded-bracelets-stackable-bracelets-14k-gold-plated-custom-jewelry-gifts-non-tarnish-lightweight,2/3 PCS Gold Anklets for Women Waterproof Cuban Link Anklet Beaded Bracelets Stackable Bracelets 14K Gold Plated Custom Jewelry Gifts Non Tarnish Lightweight,Jewelry,jewelry,Title,Default Title
holidayqbee-beaded-necklace-for-women-boho-bead-gemstone-chunky-necklace-big-bead-necklace-fashion-trendy-summer-necklaces-jewelry-gifts,HolidayQbee Beaded necklace for Women Boho Bead Gemstone Chunky Necklace Big Bead Necklace Fashion Trendy Summer Necklaces Jewelry Gifts,Jewelry,jewelry,Title,Default Title
pavoi-14k-gold-plated-3mm-cubic-zirconia-classic-tennis-bracelet-gold-bracelets-for-women,PAVOI 14K Gold Plated 3mm Cubic Zirconia Classic Tennis Bracelet | Gold Bracelets for Women,Jewelry,jewelry,Title,Default Title
pavoi-gold-plated-solid-925-sterling-silver-cz-simulated-diamond-stackable-ring-eternity-bands-for-women,PAVOI Gold Plated Solid 925 Sterling Silver CZ Simulated Diamond Stackable Ring Eternity Bands for Women,Jewelry,jewelry,Title,Default Title
kendra-scott-elisa-pendant-necklace-for-women-fashion-jewelry-14k-gold-plated,"Kendra Scott Elisa Pendant Necklace for Women, Fashion Jewelry, 14k Gold-Plated",Jewelry,jewelry,Title,Default Title
boruo-toe-rings-925-sterling-silver-band-ring-waterproof-14k-gold-plated-toe-rings-sterling-silver-rings-for-women-2-mm-3mm-4mm,"BORUO Toe Rings - 925 Sterling Silver Band Ring - Waterproof 14K Gold Plated Toe Rings - Sterling Silver Rings for Women, 2 mm, 3mm, 4mm",Jewelry,jewelry,Title,Default Title
sriomu-natural-healing-stone-fishhoop-dangle-drop-earrings-statement-gold-silver-earrings,Sriomu Natural Healing Stone Fishhoop Dangle Drop Earrings Statement Gold silver earrings,Jewelry,jewelry,Title,Default Title
hayoso-18k-gold-plated-halo-stud-earrings-925-sterling-silver-cubic-zirconia-stud-earrings-round-square-diamonique-stud-earrings-set-for-women-men,Hayoso 18K Gold Plated Halo Stud Earrings 925 Sterling Silver Cubic Zirconia Stud Earrings Round Square Diamonique Stud Earrings Set for Women Men,Jewelry,jewelry,Title,Default Title
pdwznba-love-friendship-ring-18k-gold-plated-stainless-steel-promise-ring-wedding-band-jewelry-birthday-gifts-for-women,PDWZNBA Love Friendship Ring 18K Gold-Plated Stainless Steel Promise Ring Wedding Band Jewelry Birthday Gifts for Women,Jewelry,jewelry,Title,Default Title
july-4th-independence-day-earrings-american-flag-five-pointed-star-earrings-dangle-earrings-for-women-independence-day-gifts,July 4th Independence Day Earrings American Flag Five-pointed Star Earrings Dangle Earrings for Women Independence Day Gifts,Jewelry,jewelry,Title,Default Title
ring-sizers-for-loose-rings-eiito-ring-size-adjuster-spacers-or-tightener-invisible-guards-6-sizes-fitter-resizer-fit-almost-any-rings-reduces-size-by-0-5-1-5,"Ring Sizers for Loose Rings, Eiito Ring Size Adjuster Spacers or Tightener, Invisible Guards, 6 Sizes Fitter, Resizer Fit Almost Any Rings, Reduces Size by 0.5-1.5",Jewelry,jewelry,Title,Default Title
rostivo-american-flag-earrings-for-women-4th-of-july-patriotic-earrings-cute-teardrop-faux-leather-dangle-earrings,ROSTIVO American Flag Earrings for Women 4th of July Patriotic Earrings Cute Teardrop Faux Leather Dangle Earrings,Jewelry,jewelry,Title,Default Title
mysense-4th-of-july-outfits-for-women-red-white-blue-patriotic-star-dangle-american-flag-earrings-250-anniversary-usa-merchandise-perfect-independence-day-accessories-gifts,"Mysense 4th of July Outfits for Women: Red White Blue Patriotic Star Dangle American Flag Earrings,250 Anniversary USA Merchandise, Perfect Independence Day Accessories & Gifts",Jewelry,jewelry,Title,Default Title
6-pairs-stud-earrings-set-hypoallergenic-cubic-zirconia-316l-earrings-stainless-steel-cz-earrings-3-8mm-steel-color,"6 Pairs Stud Earrings Set, Hypoallergenic Cubic Zirconia 316L Earrings Stainless Steel CZ Earrings 3-8mm (Steel color)",Jewelry,jewelry,Title,Default Title
gemqueen-piercing-taper-ball-grabber-tool-for-changing-jewelry-14g-16g-18g-20g-stainless-steel-flat-back-earrings-applicator-tool-threadless-insertion-pin-thread-body-piercing-kit-for-ear-nose-lip,GEMQUEEN Piercing Taper Ball Grabber Tool for Changing Jewelry - 14G 16G 18G 20G Stainless Steel Flat Back Earrings Applicator Tool Threadless Insertion Pin Thread Body Piercing Kit for Ear Nose Lip,Jewelry,jewelry,Title,Default Title
orangelove-hypoallergenic-nose-rings-20g-18g-16g-14g-12g-10g-8g-316l-surgical-steel-septum-jewelry-hinged-segment-ring-body-piercing-nose-hoop-lip-rings-nose-helix-cartilage-rook-earrings,ORANGELOVE Hypoallergenic Nose Rings 20G 18G 16G 14G 12G 10G 8G 316l Surgical Steel Septum Jewelry Hinged Segment Ring Body Piercing Nose Hoop Lip Rings Nose Helix Cartilage Rook Earrings,Jewelry,jewelry,Title,Default Title
theracopper-copper-bracelet-for-men-women-100-pure-copper-bracelets-raw-solid-uncoated-authentic-handmade-tibetan-bracelet-cuff-bangles,"TheraCopper Copper Bracelet for Men & Women — 100% Pure Copper Bracelets — Raw, Solid & Uncoated Authentic Handmade Tibetan Bracelet Cuff Bangles",Jewelry,jewelry,Title,Default Title
egnaro-women-s-engagement-rings-silicone-inner-arc-ergonomic-breathable-design-with-half-sizes-rubber-wedding-band-rings-5-5mm-wide-2mm-thick,"Egnaro Women's Engagement Rings, Silicone Inner Arc Ergonomic Breathable Design with half sizes, Rubber Wedding Band Rings��5.5mm Wide-2mm Thick",Jewelry,jewelry,Title,Default Title
poxtex-small-sterling-silver-huggie-hoop-earrings-set-for-women-hypoallergenic-14k-gold-plated-hoops-stacks-for-multiple-piercings-dainty-cute-mini-lightweight-cartilage-studs-trendy-jewelry-gift,"Poxtex Small Sterling Silver Huggie Hoop Earrings Set for Women, Hypoallergenic 14K Gold Plated Hoops Stacks for Multiple Piercings, Dainty Cute Mini Lightweight Cartilage Studs Trendy Jewelry Gift",Jewelry,jewelry,Title,Default Title
lpbeads-handmade-natural-gemstone-stretch-elastic-bracelet-healing-crystal-round-stone-beads-jewelry-gifts-for-women-men,LPBeads Handmade Natural Gemstone Stretch Elastic Bracelet Healing Crystal Round Stone Beads Jewelry Gifts for Women Men,Jewelry,jewelry,Title,Default Title
lolias-hypoallergenic-flat-back-earrings-cartilage-earring-stacks-surgical-steel-earrings-for-sensitive-ears-small-stainless-steel-flatback-stud-hoop-earring-sets-for-helix-tragus-conch-daith-multiple-piercing-jewelry-trendy,LOLIAS Hypoallergenic Flat Back Earrings-Cartilage Earring Stacks-Surgical Steel Earrings for Sensitive Ears - Small Stainless Steel Flatback Stud Hoop Earring Sets for Helix Tragus Conch Daith Multiple Piercing Jewelry Trendy,Jewelry,jewelry,Title,Default Title
jewlpire-18k-gold-plated-925-sterling-silver-chain-necklace-for-women-1-1mm-cable-chains-necklace-thin-dainty-sturdy-women-s-chain-necklaces-14-16-17-18-20-22-24-inches,"Jewlpire 18k Gold Plated 925 Sterling Silver Chain Necklace for Women, 1.1mm Cable Chains Necklace Thin & Dainty & Sturdy Women's Chain Necklaces, 14/16/17/18/20/22/24 Inches",Jewelry,jewelry,Title,Default Title
bioflex-clear-earrings-for-sports-work-school-surgery-mri-clear-piercing-jewelry-labret-studs-for-ears-cartilage-helix-tragus-lip-medusa-monroe-flat-push-in-plastic-earrings-16g-18g-piercing-retainers,"Bioflex Clear Earrings for Sports, Work, School, Surgery, MRI - Clear Piercing Jewelry Labret Studs for Ears, Cartilage, Helix, Tragus, Lip, Medusa, Monroe - Flat Push-In Plastic Earrings (16g, 18g) Piercing Retainers",Jewelry,jewelry,Title,Default Title
316l-surgical-steel-hypoallergenic-hinged-nose-ring-hoop-for-women-men-seamless-clasp-used-in-nostril-septum-lip-and-all-ear-piercings-20-gauge-to-6-gauge-inner-diameter-5mm-to-22mm,"316L Surgical Steel Hypoallergenic Hinged Nose Ring Hoop for Women & Men | Seamless Clasp, Used in Nostril, septum, lip, and all ear piercings. 20 Gauge to 6 Gauge, Inner Diameter 5mm to 22mm",Jewelry,jewelry,Title,Default Title
small-gold-huggie-hoop-earrings-set-for-women-men-hypoallergenic-14k-plated-stack-cartilage-earrings-sterling-silver-multiple-piercing-lightweight-mini-thin-cute-dainty-trendy-jewelry-gifts-for-women,"Small Gold Huggie Hoop Earrings Set for Women Men Hypoallergenic 14K Plated Stack Cartilage Earrings, Sterling Silver Multiple Piercing Lightweight Mini Thin Cute Dainty Trendy Jewelry Gifts for Women",Jewelry,jewelry,Title,Default Title
4th-of-july-independence-day-patriotic-earring-for-women-american-flag-dangle-earrings-patriotic-red-white-blue-usa-earring-pave-crystal-stud,"4th of July Independence Day Patriotic Earring for Women American Flag Dangle Earrings Patriotic Red White Blue USA Earring, Pave Crystal Stud",Jewelry,jewelry,Title,Default Title
mysense-250-anniversary-usa-merchandise-red-white-blue-patriotic-acrylic-teardrop-dangle-earrings-ideal-for-4th-of-july-outfits-accessories-perfect-patriotic-gift-for-women,"Mysense 250 Anniversary USA Merchandise,Red White & Blue Patriotic Acrylic Teardrop Dangle Earrings,Ideal for 4th of July Outfits & Accessories,Perfect Patriotic Gift for Women",Jewelry,jewelry,Title,Default Title
250th-anniversary-usa-shirt-patriotic-glitter-star-earring-for-250-anniversary-america-merchandise-4th-of-july-outfits-for-women-fourth-of-july-accessories-memorial-day-decorations-for-girls,"250th Anniversary USA Shirt - Patriotic Glitter Star Earring for 250 Anniversary America Merchandise - 4th of July Outfits for Women,Fourth of July Accessories | Memorial Day Decorations for Girls",Jewelry,jewelry,Title,Default Title
dorana-jewelry-for-her-gift-3-pairs-925-sterling-silver-earrings-for-women-non-tarnish-14k-gold-plated-small-hypoallergenic-huggie-hoops-cartilage-stack-earring-sets-for-multiple-piercing,DORANA Jewelry for Her Gift 3 Pairs 925 Sterling Silver Earrings for Women Non Tarnish 14K Gold Plated Small Hypoallergenic Huggie Hoops Cartilage Stack Earring Sets for Multiple Piercing,Jewelry,jewelry,Title,Default Title
6-pairs-14k-gold-plated-stud-earrings-for-women-hypoallergenic-cartilage-earrings-for-multiple-piercing-dainty-small-stackable-earrings-set-for-jewelry-gift,"6 Pairs 14K Gold Plated Stud Earrings for Women, Hypoallergenic Cartilage Earrings for Multiple Piercing, Dainty Small Stackable Earrings Set for Jewelry Gift",Jewelry,jewelry,Title,Default Title
tony-sandy-friend-gifts-for-women-unique-birthday-gifts-for-women-sister-gift-from-sister-wave-bracelet-christmas-graduation-mothers-day-gift-for-her-bestie-friendship-bracelets,"TONY & SANDY Friend Gifts for Women, Unique Birthday Gifts for Women, Sister Gift from Sister, Wave Bracelet, Christmas Graduation Mothers Day Gift for Her, Bestie Friendship Bracelets",Jewelry,jewelry,Title,Default Title
aozel-gold-silver-plated-anklet-bracelets-for-women-waterproof-plus-size-cuban-link-chain-ankle-bracelet-for-large-ankle-9-12inch,AOZEL Gold/Silver Plated Anklet Bracelets for Women Waterproof Plus Size Cuban Link Chain Ankle Bracelet for Large Ankle 9-12inch,Jewelry,jewelry,Title,Default Title
5-pairs-14k-gold-plated-huggie-hoop-earrings-for-women-lightweight-minimalist-small-hoops-hypoallergenic-nickel-free-lead-free-non-tarnish-everyday-jewelry-for-sensitive-ears-multiple-piercing-stack-set,"5 Pairs 14K Gold Plated Huggie Hoop Earrings for Women - Lightweight Minimalist Small Hoops, Hypoallergenic Nickel-free Lead-free, Non-Tarnish Everyday Jewelry for Sensitive Ears, Multiple Piercing Stack Set",Jewelry,jewelry,Title,Default Title
jewlpire-925-sterling-silver-chain-necklace-chain-for-women-1-1mm-cable-chains-necklace-upgraded-spring-ring-clasp-thin-sturdy-women-s-chains-necklaces-14-16-18-20-22-24-inch,Jewlpire 925 Sterling Silver Chain Necklace Chain for Women 1.1mm Cable Chains Necklace Upgraded Spring-Ring Clasp - Thin & Sturdy Women's Chains Necklaces 14 16 18 20 22 24 Inch,Jewelry,jewelry,Title,Default Title
jstyle-hypoallergenic-stud-hoop-earrings-for-women-small-flat-back-surgical-stainless-steel-earrings-for-sensitive-ears-trendy-silver-hoops-cartilage-earring-stacks-set-multiple-piercing-jewelry-gifts,Jstyle Hypoallergenic Stud Hoop Earrings for Women Small Flat Back Surgical Stainless Steel Earrings for Sensitive Ears Trendy Silver Hoops Cartilage Earring Stacks Set Multiple Piercing Jewelry Gifts,Jewelry,jewelry,Title,Default Title
pavoi-14k-gold-plated-solid-925-sterling-silver-post-cubic-zirconia-stud-flat-back-earrings-for-women-cartilage-earring-helix-piercing-jewelry-small-stud-earrings-for-women,PAVOI 14K Gold Plated Solid 925 Sterling Silver Post Cubic Zirconia Stud Flat Back Earrings for Women | Cartilage Earring | Helix Piercing Jewelry | Small Stud Earrings for Women,Jewelry,jewelry,Title,Default Title
egnaro-4-5-8-variety-multipack-ergonomic-breathable-bridal-rings-sets-6mm-wide-2mm-thick-rubber-wedding-bands-women-silicone-rings-for-her-with-half-size,"Egnaro 4/5/8 Variety Multipack Ergonomic Breathable Bridal Rings Sets, 6mm Wide - 2mm Thick Rubber Wedding bands women, silicone Rings for her with Half Size",Jewelry,jewelry,Title,Default Title
6-pairs-14k-gold-plated-hoop-earrings-for-women-lightweight-chunky-hoop-earrings-multipack-hypoallergenic-thick-open-twisted-huggie-hoops-earring-set-jewelry-for-gifts,"6 Pairs 14K Gold Plated Hoop Earrings for Women Lightweight Chunky Hoop Earrings Multipack Hypoallergenic, Thick Open Twisted Huggie Hoops Earring Set Jewelry for Gifts.",Jewelry,jewelry,Title,Default Title
blessmylove-316l-surgical-steel-22g-20g-18g-nose-rings-studs-l-shape-nose-nostrial-piercing-body-jewerly-l-shaped-nose-studs-1-5mm-2mm-2-5mm-3mm-cz-nose-screw-studs-rings-for-women,BLESSMYLOVE 316L Surgical Steel 22g/20g/18g Nose Rings Studs L-Shape Nose Nostrial Piercing Body Jewerly L Shaped Nose Studs 1.5mm 2mm 2.5mm 3mm CZ Nose Screw Studs Rings for Women,Jewelry,jewelry,Title,Default Title
gokeey-316l-surgical-stainless-steel-small-gold-silver-hoop-earrings-for-women-men-hypoallergenic-cartilage-helix-earrings-for-sensitive-ears-cute-conch-rook-tiny-huggie-hoops-earring-set-for-multiple-piercing-jewelry-gift-6mm-12mm,"Gokeey 316L Surgical Stainless Steel Small Gold Silver Hoop Earrings for Women Men,Hypoallergenic Cartilage Helix Earrings for Sensitive Ears,Cute Conch Rook Tiny Huggie Hoops Earring Set for Multiple Piercing Jewelry Gift 6mm-12mm",Jewelry,jewelry,Title,Default Title
lolias-flat-back-earrings-for-women-hypoallergenic-surgical-steel-earrings-for-sensitive-ears-20g-cartilage-earring-stacks-14k-gold-plated-hoops-flatback-stud-earring-sets-for-multiple-piercing,LOLIAS Flat Back Earrings for Women Hypoallergenic Surgical Steel Earrings for Sensitive Ears-20G Cartilage Earring Stacks 14K Gold Plated Hoops Flatback Stud Earring Sets for Multiple Piercing,Jewelry,jewelry,Title,Default Title
bagsmart-quilted-crossbody-bags-for-women-travel-purses-hobo-shoulder-bag-fits-12-9-ipad-long-adjustable-strap-puffer-purses-for-commute-daily-use-travel-essentials-inner-pockets-water-resistant,"BAGSMART Quilted Crossbody Bags for Women, Travel Purses Hobo Shoulder Bag | Fits 12.9"" iPad, Long Adjustable Strap, Puffer Purses for Commute Daily Use Travel Essentials, Inner Pockets, Water-resistant",Handbag,bags,Title,Default Title
joryin-woven-womens-crossbody-bag-evening-purse-trendy-dumpling-clutch-hobo-cloud-shoulder-bag-trendy-dumpling-clutch,"Joryin Woven Women's Crossbody Bag & Evening Purse, Trendy Dumpling Clutch & Hobo Cloud Shoulder Bag Trendy Dumpling Clutch",Handbag,bags,Title,Default Title
bagstellar-puffer-tote-bag-for-women-lightweight-puffy-work-handbag-teacher-nurse-quilted-shoulder-bag-for-school-travel-gym-cloud-bag-w-zipper,"Bagstellar Puffer Tote Bag for Women, Lightweight Puffy Work Handbag Teacher Nurse Quilted Shoulder Bag for School Travel Gym | Cloud Bag w/ Zipper",Handbag,bags,Title,Default Title
cyhtwsdj-shoulder-bags-for-women-cute-hobo-tote-handbag-mini-clutch-purse-with-zipper-closure,"CYHTWSDJ Shoulder Bags for Women, Cute Hobo Tote Handbag Mini Clutch Purse with Zipper Closure",Handbag,bags,Title,Default Title
aphison-trendy-leather-crossbody-purse-with-adjustable-strap-womens-shoulder-handbag,"APHISON Trendy Leather Crossbody Purse with Adjustable Strap, Women's Shoulder Handbag",Handbag,bags,Title,Default Title
kalidi-beach-nylon-mesh-tote-bag-casual-tote-bag-hobo-women-foldable-max-23l-shoulder-bag-for-beach-picnic-vacation,"KALIDI Beach Nylon Mesh Tote Bag, Casual Tote Bag Hobo Women Foldable MAX 23L Shoulder Bag For Beach Picnic Vacation",Handbag,bags,Title,Default Title
kkxiu-shoulder-bag-for-women-small-clutch-purses-cute-hobo-handbag-trendy-underarm-bag,KKXIU Shoulder Bag for Women Small Clutch Purses Cute Hobo Handbag Trendy Underarm Bag,Handbag,bags,Title,Default Title
bagsmart-small-sling-bag-for-women-puffer-crossbody-bag-purses-hobo-handbag-fanny-packs-for-travel-hiking,"BAGSMART Small Sling Bag for Women, Puffer Crossbody Bag Purses Hobo Handbag Fanny Packs for Travel Hiking",Handbag,bags,Title,Default Title
bagsmart-small-crossbody-bags-for-women-puffer-cute-bum-bag-with-pouch-quilted-purse-for-daily-travel-college,"BAGSMART Small Crossbody Bags for Women, Puffer Cute Bum Bag with Pouch, Quilted Purse for Daily Travel College",Handbag,bags,Title,Default Title
mintegra-women-shoulder-handbag-roomy-multiple-pockets-bag-ladies-crossbody-purse-fashion-tote-top-handle-satchel,MINTEGRA Women Shoulder Handbag Roomy Multiple Pockets Bag Ladies Crossbody Purse Fashion Tote Top Handle Satchel,Handbag,bags,Title,Default Title
inicat-womens-small-sling-bag-lightweight-everyday-vegan-leather-crossbody-purse-for-daily-essentials-and-travel-light,"INICAT Women's Small Sling Bag, Lightweight Everyday Vegan Leather Crossbody Purse for Daily Essentials and Travel Light",Handbag,bags,Title,Default Title
bagsmart-tote-bag-for-women-lightweight-puffy-tote-bag-with-compartments-shoulder-bag-handbag-for-travel-work-gym-lightweight,"BAGSMART Tote Bag for Women, Lightweight Puffy Tote Bag with Compartments Shoulder Bag Handbag for Travel, Work, Gym | Lightweight",Handbag,bags,Title,Default Title
angelkiss-hobo-purses-and-handbags-for-women-satchel-handbag-women-purses-large-daily-shoulder-bags-purses,Angelkiss Hobo Purses and handbags for Women Satchel Handbag Women Purses Large Daily Shoulder Bags | Purses,Handbag,bags,Title,Default Title
biaotie-lightweight-small-crossbody-bags-cell-phone-purses-travel-pouch-shoulder-bag-for-women,BIAOTIE Lightweight Small Crossbody bags Cell Phone Purses Travel Pouch Shoulder Bag for Women,Handbag,bags,Title,Default Title
kalidi-women-corduroy-tote-bag-zipper-casual-totes-handbag-big-capacity-shoulder-bag-with-pockets,KALIDI Women Corduroy Tote Bag Zipper Casual Tote's Handbag Big Capacity Shoulder Bag with Pockets,Handbag,bags,Title,Default Title
montana-west-crossbody-bag-for-women-large-bum-bag-purse-soft-vegan-leather-travel-fanny-pack-with-coin-purse,"Montana West Crossbody Bag for Women, Large Bum Bag Purse Soft Vegan Leather Travel Fanny Pack with Coin Purse",Handbag,bags,Title,Default Title
kkxiu-shoulder-bag-for-women-cute-hobo-purses-and-handbags-retro-clutch-underarm-purse-cute,KKXIU Shoulder Bag for Women Cute Hobo Purses and Handbags Retro Clutch Underarm Purse | Cute,Handbag,bags,Title,Default Title
cookooky-crochet-beach-tote-bag-summer-beach-bag-for-women-aesthetic-mesh-tote-bag-hippie-bag-knit-bag,COOKOOKY Crochet Beach Tote bag Summer Beach Bag for Women Aesthetic Mesh Tote Bag Hippie Bag Knit Bag,Handbag,bags,Title,Default Title
fashion-mini-crossbody-bag-handbags-purses-with-adjustable-strap-for-women-ladies-shoulder-totes-bag,"Fashion Mini Crossbody Bag, Handbags Purses with Adjustable Strap for Women, Ladies Shoulder Totes Bag",Handbag,bags,Title,Default Title
dihklcio-clutch-purses-for-women-2026-summer-beach-woven-crochet-bag-dumpling-striped-ruched-cloud-purse-evening-handbag,DIHKLCIO Clutch Purses for Women 2026 Summer Beach Woven Crochet Bag Dumpling Striped Ruched Cloud Purse Evening Handbag,Handbag,bags,Title,Default Title
