Handle,Title,Type,Tags,Option1 Name,Option1 Value
anrabess-womens-wide-leg-palazzo-pants-with-pockets-lightweight-breathable-high-waisted-pants-beach-vacation-flowy-lounge-casual-summer-trousers,"ANRABESS Womens Wide Leg Palazzo Pants with Pockets | Lightweight Breathable High Waisted Pants, Beach Vacation Flowy, Lounge & Casual Summer Trousers",Apparel,clothing,Title,Default Title
hanes-women-s-pajamas-set-comfywear-pajamas-for-women-set-originals-supertsoft-loungewear-t-shirt-sleep-shorts,"Hanes Women's Pajamas Set, Comfywear Pajamas for Women Set, Originals SupertSoft Loungewear, T-Shirt & Sleep Shorts",Apparel,clothing,Title,Default Title
playtex-women-s-wireless-bra-18-hour-plus-size-bras-available-full-coverage-smoothing-4693-single-or-2-pack,"Playtex Women's Wireless Bra, 18 Hour Plus-Size Bras Available, Full Coverage, Smoothing, 4693, Single or 2-Pack",Apparel,clothing,Title,Default Title
cicy-bell-womens-summer-v-neck-t-shirts-casual-short-sleeve-flowy-tops-cute-loose-fit-basic-tees,Cicy Bell Womens Summer V Neck T Shirts Casual Short Sleeve Flowy Tops Cute Loose Fit Basic Tees,Apparel,clothing,Title,Default Title
hanes-mens-underwear-boxer-briefs-pack-cool-breathable-cotton-moisture-wicking-underwear-for-men-no-ride-up,"Hanes mens Underwear Boxer Briefs Pack, Cool & Breathable Cotton Moisture-wicking Underwear for Men, No Ride Up",Apparel,clothing,Title,Default Title
gildan-men-s-crew-t-shirts-multipack-style-g1100,"Gildan Men's Crew T-Shirts, Multipack, Style G1100",Apparel,clothing,Title,Default Title
hanes-men-s-undershirt-packs-stay-tucked-soft-cotton-undershirts-best-undershirts-for-men-white-black-asstd-multipacks,"Hanes Men's Undershirt Packs, Stay-Tucked Soft Cotton Undershirts, Best Undershirts for Men, White/Black/Asstd Multipacks",Apparel,clothing,Title,Default Title
lee-men-s-extreme-motion-crossroad-cargo-short,Lee Men's Extreme Motion Crossroad Cargo Short,Apparel,clothing,Title,Default Title
coofandy-men-s-linen-shirts-short-sleeve-casual-shirts-button-down-shirt-for-men-beach-summer-wedding-shirt,COOFANDY Men's Linen Shirts Short Sleeve Casual Shirts Button Down Shirt for Men Beach Summer Wedding Shirt,Apparel,clothing,Title,Default Title
balennz-athletic-shorts-for-men-with-pockets-and-elastic-waistband-quick-dry-activewear,BALENNZ Athletic Shorts for Men with Pockets and Elastic Waistband Quick Dry Activewear,Apparel,clothing,Title,Default Title
comfort-colors-adult-heavyweight-short-sleeve-tee-style-g1717-g1745-multipack,"Comfort Colors Adult Heavyweight Short Sleeve Tee, Style G1717/G1745, Multipack",Apparel,clothing,Title,Default Title
dickies-men-s-dri-tech-original-moisture-control-crew-socks-available-in-m-xxl-6-12-18-pairs,"Dickies Men's Dri-tech Original Moisture Control Crew Socks, Available in M-xxl (6, 12, 18 Pairs)",Apparel,clothing,Title,Default Title
roxun-arm-sleeves-cooling-uv-sun-protection-sports-compression-for-men-women,"ROXUN Arm Sleeves, Cooling UV Sun Protection Sports Compression for Men/Women",Apparel,clothing,Title,Default Title
fruit-of-the-loom-men-s-sleeveless-tag-free-moisture-wicking-tank-a-shirt,Fruit of the Loom Men's Sleeveless Tag Free Moisture Wicking Tank A-Shirt,Apparel,clothing,Title,Default Title
fruit-of-the-loom-men-s-crew-tee-undershirts-moisture-wicking-tag-free-also-available-in-big-tall,"Fruit of The Loom Men's Crew Tee Undershirts, Moisture Wicking & Tag Free, Also Available in Big & Tall",Apparel,clothing,Title,Default Title
maamgic-2-in-1-mens-swim-trunks-7-inch-swim-shorts-swim-suits-board-shorts,maamgic 2 in 1 Mens Swim Trunks 7 Inch Swim Shorts Swim Suits Board Shorts,Apparel,clothing,Title,Default Title
ny-threads-men-s-athletic-shorts-quick-dry-loose-fit-lightweight-running-workout-gym-shorts-with-pockets,NY Threads Men's Athletic Shorts Quick Dry Loose-Fit Lightweight Running Workout Gym Shorts with Pockets,Apparel,clothing,Title,Default Title
hanes-men-s-zip-up-hoodie-ecosmart-fleece-full-zip-hoodie-for-men-hooded-sweatshirt,"Hanes Men's Zip-up Hoodie, Ecosmart Fleece Full-zip Hoodie for Men, Hooded Sweatshirt",Apparel,clothing,Title,Default Title
northyard-men-s-athletic-running-shorts-gym-workout-7-9-5-quick-dry-lightweight-sports-basketball-tennis-3-zipper-pockets,"NORTHYARD Men's Athletic Running Shorts Gym Workout 7""/9""/5"" Quick Dry Lightweight Sports Basketball Tennis 3 Zipper Pockets",Apparel,clothing,Title,Default Title
under-armour-men-s-tech-golf-polo,Under Armour Men's Tech Golf Polo,Apparel,clothing,Title,Default Title
gildan-adult-heavy-cotton-t-shirt-style-g5000,"Gildan Adult Heavy Cotton T-Shirt, Style G5000",Apparel,clothing,Title,Default Title
bamboo-cool-men-s-ultra-breathable-underwear-no-riding-up-boxer-briefs-with-comfortflexible-waistband-multipack,"BAMBOO COOL Men's Ultra Breathable Underwear,No Riding Up Boxer Briefs with ComfortFlexible Waistband,Multipack",Apparel,clothing,Title,Default Title
under-armour-men-s-tech-2-0-short-sleeve-t-shirt,Under Armour Men's Tech 2.0 Short-Sleeve T-Shirt,Apparel,clothing,Title,Default Title
hanes-men-s-tank-undershirt-pack-cotton-tank-undershirt-moisture-wicking-breathable-white-or-grey-black-multi-pack,"Hanes Men's Tank Undershirt Pack, Cotton Tank Undershirt, Moisture-Wicking, Breathable, White or Grey/Black, Multi-Pack",Apparel,clothing,Title,Default Title
roadbox-upf-50-fishing-shirts-for-men-long-sleeve-uv-sun-protection-hoodie-outdoor-hiking-running-swimming-rash-guard,"Roadbox UPF 50+ Fishing Shirts for Men, Long Sleeve UV Sun Protection Hoodie, Outdoor Hiking Running Swimming Rash Guard",Apparel,clothing,Title,Default Title
wrangler-authentics-men-s-relaxed-fit-stretch-cargo-pant,Wrangler Authentics Men's Relaxed Fit Stretch Cargo Pant,Apparel,clothing,Title,Default Title
ft-fenteng-mens-swim-trunks-quick-dry-board-shorts-with-mesh-liner-breathable-big-tall-beach-shorts-swimwear-bathing-suits,"FT FENTENG Mens Swim Trunks Quick Dry Board Shorts with Mesh Liner, Breathable Big & Tall Beach Shorts Swimwear Bathing Suits",Apparel,clothing,Title,Default Title
levi-s-men-s-505-regular-fit-jeans-also-available-in-big-tall,Levi's Men's 505 Regular Fit Jeans (Also Available in Big & Tall),Apparel,clothing,Title,Default Title
gildan-men-s-a-shirts-tanks-multipack,Gildan Men's A-Shirts Tanks Multipack,Apparel,clothing,Title,Default Title
fruit-of-the-loom-men-s-underwear-briefs-tag-free-moisture-wicking,"Fruit of the Loom Men's Underwear Briefs, Tag Free & Moisture Wicking",Apparel,clothing,Title,Default Title
hanes-men-s-underwear-boxers-pack-cool-breathable-cotton-underwear-moisture-wicking-boxers-for-men,"Hanes Men's Underwear Boxers Pack, Cool & Breathable Cotton Underwear, Moisture-Wicking Boxers for Men",Apparel,clothing,Title,Default Title
hanes-men-s-hoodie-ecosmart-fleece-hooded-sweatshirt-for-men-women-midweight-fleece-big-tall-available,Hanes Men's Hoodie - EcoSmart Fleece Hooded Sweatshirt for Men & Women - Midweight Fleece - Big & Tall Available,Apparel,clothing,Title,Default Title
amazon-essentials-men-s-lightweight-breathable-cotton-slim-fit-tank-undershirts-pack-of-6,"Amazon Essentials Men's Lightweight Breathable Cotton Slim Fit Tank Undershirts, Pack of 6",Apparel,clothing,Title,Default Title
comdecevis-men-s-linen-shorts-casual-elastic-waist-drawstring-summer-beach-vacation-yoga-golf-shorts-with-pockets,Comdecevis Men's Linen Shorts Casual Elastic Waist Drawstring Summer Beach Vacation Yoga Golf Shorts with Pockets,Apparel,clothing,Title,Default Title
lee-men-s-big-tall-extreme-motion-flat-front-short,Lee Men’s Big & Tall Extreme Motion Flat Front Short,Apparel,clothing,Title,Default Title
hanes-men-s-t-shirt-pack-4-pack-essential-t-crewneck-cotton-t-shirts-everyday-men-s-tees-big-tall-available,Hanes Men's T-Shirt Pack - 4-Pack - Essential-T Crewneck Cotton T-Shirts - Everyday Men's Tees - Big & Tall Available,Apparel,clothing,Title,Default Title
5-pack-men-s-active-quick-dry-crew-neck-t-shirts-athletic-running-gym-workout-short-sleeve-tee-tops-bulk,5 Pack Men’s Active Quick Dry Crew Neck T Shirts | Athletic Running Gym Workout Short Sleeve Tee Tops Bulk,Apparel,clothing,Title,Default Title
magcomsen-men-s-long-sleeve-shirts-upf-50-uv-sun-protection-athletic-shirts-for-hiking-running-workout-rash-guard,MAGCOMSEN Men's Long Sleeve Shirts UPF 50+ UV Sun Protection Athletic Shirts for Hiking Running Workout Rash Guard,Apparel,clothing,Title,Default Title
maamgic-mens-swim-trunks-quick-dry-swim-shorts-with-mesh-lining-funny-swimwear-bathing-suits-7inch,maamgic Mens Swim Trunks Quick Dry Swim Shorts with Mesh Lining Funny Swimwear Bathing Suits 7inch,Apparel,clothing,Title,Default Title
hanes-mens-underwear-boxers-pack-cool-and-breathable-cotton-underwear-exposed-and-comfortflex-waistbands-multi-pack,"Hanes mens Underwear Boxers Pack, Cool and Breathable Cotton Underwear, Exposed and Comfortflex Waistbands, Multi-pack",Apparel,clothing,Title,Default Title
heralady-4th-of-july-shirts-mens-muscle-tank-top-1776-sleeveless-graphic-gym-workout-american-flag-shirt,Heralady 4th of July Shirts Mens Muscle Tank Top 1776 Sleeveless Graphic Gym Workout American Flag Shirt,Apparel,clothing,Title,Default Title
men-s-dungarees-new-belted-wyoming-cargo-short,Men's Dungarees New Belted Wyoming Cargo Short,Apparel,clothing,Title,Default Title
hanes-men-s-shorts-essentials-short-with-pockets-gym-shorts-for-men-men-s-athletic-shorts-7-5,"Hanes Men's Shorts, Essentials Short with Pockets, Gym Shorts for Men, Men's Athletic Shorts, 7.5""",Apparel,clothing,Title,Default Title
rustler-men-s-classic-relaxed-fit,Rustler Men's Classic Relaxed Fit,Apparel,clothing,Title,Default Title
libin-mens-golf-pants-stretch-work-dress-pants-30-32-34-quick-dry-lightweight-casual-comfy-trousers-with-pockets,"Libin Mens Golf Pants Stretch Work Dress Pants 30""/32""/34"" Quick Dry Lightweight Casual Comfy Trousers with Pockets",Apparel,clothing,Title,Default Title
under-armour-men-s-tech-graphic-10-shorts,"Under Armour Men's Tech Graphic 10"" Shorts",Apparel,clothing,Title,Default Title
bamboo-cool-men-s-ultra-comfortsoft-underwear-moisture-wicking-breathable-no-ride-up-boxer-briefs-with-fly-multipack,"BAMBOO COOL Men's Ultra ComfortSoft Underwear, Moisture Wicking & Breathable No Ride Up Boxer Briefs with Fly, Multipack",Apparel,clothing,Title,Default Title
bamboo-cool-men-s-crew-socks-athletic-running-sports-socks-cushioned-moisture-wicking-breathable-arch-support-6-pack,"BAMBOO COOL Men's Crew Socks Athletic Running Sports Socks, Cushioned Moisture Wicking, Breathable Arch Support 6 Pack",Apparel,clothing,Title,Default Title
g-gradual-men-s-athletic-workout-t-shirts-moisture-wicking-cooling-running-shirts-short-sleeve-performance-tee-for-gym-tennis,G Gradual Men's Athletic Workout T-Shirts Moisture Wicking Cooling Running Shirts Short Sleeve Performance Tee for Gym Tennis,Apparel,clothing,Title,Default Title
musesox-compression-socks-for-women-and-men-knee-high-15-20mmhg-graduated-support-3-pairs-best-for-nurses-pregnant-travel,"musesox Compression Socks for Women and Men,Knee High 15-20mmHg Graduated Support(3 Pairs) Best for Nurses,Pregnant,Travel",Apparel,clothing,Title,Default Title
gildan-men-s-v-neck-t-shirts-multipack-style-g1103,"Gildan Men's V-Neck T-Shirts, Multipack, Style G1103",Apparel,clothing,Title,Default Title
under-armour-men-s-sportstyle-left-chest-logo-short-sleeve-t-shirt,Under Armour Men's Sportstyle Left Chest Logo Short-Sleeve T-Shirt,Apparel,clothing,Title,Default Title
dickies-men-s-dri-tech-moisture-control-quarter-socks-available-in-m-xxl-6-12-18-pairs,"Dickies Men's Dri-Tech Moisture Control Quarter Socks, Available in M-XXL (6, 12, 18 Pairs)",Apparel,clothing,Title,Default Title
adidas-men-s-athletic-cushioned-crew-socks-6-pairs-durable-comfortable,adidas Men's Athletic Cushioned Crew Socks (6 Pairs) Durable & Comfortable,Apparel,clothing,Title,Default Title
amazon-essentials-men-s-regular-fit-sleeveless-tank-tops,Amazon Essentials Men's Regular-Fit Sleeveless Tank Tops,Apparel,clothing,Title,Default Title
wrangler-authentics-men-s-comfort-flex-waist-relaxed-fit-jean,Wrangler Authentics Men's Comfort Flex Waist Relaxed Fit Jean,Apparel,clothing,Title,Default Title
soothfeel-men-s-running-shorts-with-zipper-pockets-9-7-5-quick-dry-eight-basketball-gym-workout-athletic-shorts,"Soothfeel Men's Running Shorts with Zipper Pockets 9""/ 7""/ 5"" Quick Dry Eight Basketball Gym Workout Athletic Shorts",Apparel,clothing,Title,Default Title
snug-leaves-womens-fuzzy-scuff-slippers-soft-comfy-memory-foam-non-slip-indoor-house-shoes,Snug Leaves Women's Fuzzy Scuff Slippers Soft Comfy Memory Foam Non-slip Indoor House Shoes,Shoes,shoes,Title,Default Title
project-cloud-100-genuine-leather-flat-sandals-for-women-2026-cork-footbed-womens-sandals-with-memory-foam-and-arch-support-vacation-essentials-slides-for-women-footwear-venita,Project Cloud 100% Genuine Leather Flat Sandals For Women 2026 Cork Footbed Womens Sandals with Memory Foam and arch support Vacation Essentials Slides for Women Footwear (Venita),Shoes,shoes,Title,Default Title
goosecret-womens-comfortable-arch-support-walking-platform-sandals-lightweight-chunky-slip-on-foam-slides-with-adjustable-buckle-sandals-for-beach-and-daily-wear,"Goosecret Women's Comfortable Arch Support Walking Platform Sandals | Lightweight Chunky Slip-On Foam Slides with Adjustable Buckle, Sandals for Beach and Daily Wear",Shoes,shoes,Title,Default Title
project-cloud-100-genuine-leather-sandals-women-dressy-beach-essentials-slides-for-women-footwear-lightweight-with-memory-foam-insole-sandals-for-women-2026-womens-slides,Project Cloud 100% Genuine Leather Sandals Women Dressy Beach Essentials Slides for Women Footwear - Lightweight with Memory Foam Insole Sandals for Women 2026 - Womens Slides,Shoes,shoes,Title,Default Title
project-cloud-100-genuine-leather-flat-sandals-for-women-2026-comfortable-beach-essentials-womens-sandals-memory-foam-vacation-essentials-slides-for-women-footwear-santorini,Project Cloud 100% Genuine Leather Flat Sandals for Women 2026 Comfortable Beach Essentials Womens Sandals Memory Foam Vacation Essentials Slides for Women Footwear (Santorini),Shoes,shoes,Title,Default Title
mazeskin-womens-memory-foam-comfortable-flat-thong-sandals-dressy-summer-beach-leather-slide-flip-flops,mazeskin Women's Memory Foam Comfortable Flat Thong Sandals Dressy Summer Beach Leather Slide Flip Flops,Shoes,shoes,Title,Default Title
mazeskin-womens-flip-flops-vegan-leather-memory-foam-square-toe-flat-sandals-summer-beach-slides,mazeskin Womens Flip Flops Vegan Leather Memory Foam Square Toe Flat Sandals Summer Beach Slides,Shoes,shoes,Title,Default Title
water-shoes-for-women-men-quick-dry-aqua-socks-swim-beach-outfits-barefoot-yoga-exercise-wear-sport-accessories-pool-camping-must-haves-river-hiking-adult-youth-size,Water Shoes for Women Men Quick-Dry Aqua Socks Swim Beach Outfits Barefoot Yoga Exercise Wear Sport Accessories Pool Camping Must Haves River Hiking Adult Youth Size,Shoes,shoes,Title,Default Title
seekway-water-shoes-men-women-adult-quick-dry-aqua-sock-barefoot-for-beach-swim-river-pool-lake-hiking-kayaking-surfing,SEEKWAY Water Shoes Men Women Adult Quick-Dry Aqua Sock Barefoot for Beach Swim River Pool Lake Hiking Kayaking Surfing,Shoes,shoes,Title,Default Title
kuailu-flip-flops-for-women-with-arch-support-yoga-mat-comfortable-summer-beach-walking-thong-cushion-sandals-slip-on-indoor-outdoor,KuaiLu Flip Flops for Women with Arch Support Yoga Mat Comfortable Summer Beach Walking Thong Cushion Sandals Slip On Indoor Outdoor,Shoes,shoes,Title,Default Title
archies-arch-support-flip-flops-for-men-women-orthotic-sandals-for-plantar-fasciitis-relief-lightweight-cushioning-shock-absorbing-thong-sandals-for-walking-foot-pain-all-day-comfort,"Archies Arch Support Flip Flops for Men & Women – Orthotic Sandals for Plantar Fasciitis Relief – Lightweight, Cushioning, Shock-Absorbing Thong Sandals for Walking, Foot Pain & All-Day Comfort",Shoes,shoes,Title,Default Title
crocs-unisex-adult-classic-clog-clogs-for-women-and-men,"Crocs Unisex-Adult Classic Clog, Clogs for Women and Men",Shoes,shoes,Title,Default Title
project-cloud-flip-flops-for-women-footwear-lightweight-and-memory-foam-insole-sandals-for-women-2026-durable-non-slip-beach-essentials-flats-for-women-sandals-foundations,Project Cloud Flip Flops for Women Footwear- Lightweight and Memory Foam Insole Sandals for Women 2026 - Durable Non-Slip Beach Essentials Flats for Women Sandals (Foundations),Shoes,shoes,Title,Default Title
mazeskin-women-s-memory-foam-comfortable-flat-thong-sandals-dressy-summer-beach-leather-slide-flip-flops,mazeskin Women's Memory Foam Comfortable Flat Thong Sandals Dressy Summer Beach Leather Slide Flip Flops,Shoes,shoes,Title,Default Title
bronax-pillow-slippers-for-women-and-men-house-slides-shower-sandals-cushioned-thick-sole,BRONAX Pillow Slippers for Women and Men | House Slides Shower Sandals | Cushioned Thick Sole,Shoes,shoes,Title,Default Title
seekway-water-shoes-women-men-adult-quick-dry-aqua-socks-barefoot-non-slip-for-beach-swim-river-pool-lake-surf-black-sk002-u,SEEKWAY Water Shoes Women Men Adult Quick-Dry Aqua Socks Barefoot Non Slip for Beach Swim River Pool Lake surf Black SK002(U),Shoes,shoes,Title,Default Title
cushionaire-lane-cork-footbed-womens-sandals-comfortable-double-buckle-slip-on-sandals-for-women-with-arch-support-and-classic-two-strap-design,CUSHIONAIRE Lane Cork Footbed Womens Sandals Comfortable Double Buckle Slip On Sandals for Women with Arch Support and Classic Two Strap Design,Shoes,shoes,Title,Default Title
cushionaire-siesta-modern-lattice-ballet-flats-for-women-comfortable-slip-on-pointed-toe-womens-jelly-shoes,"CUSHIONAIRE Siesta Modern Lattice Ballet Flats for Women, Comfortable Slip On Pointed Toe Womens Jelly Shoes",Shoes,shoes,Title,Default Title
cushionaire-pool-slides-for-women-water-resistant-double-buckle-adjustable-slip-on-womens-sandals-for-beach-shower-casual-wear,CUSHIONAIRE Pool Slides for Women Water Resistant Double Buckle Adjustable Slip-On Womens Sandals for Beach Shower Casual Wear,Shoes,shoes,Title,Default Title
water-shoes-mens-women-barefoot-shoes-quick-dry-aqua-outdoor-sports-for-swim-pool-beach-surf-walk-water-yoga-river-lake-hiking-kayaking,Water Shoes Mens Women Barefoot Shoes Quick Dry Aqua Outdoor Sports for Swim Pool Beach Surf Walk Water Yoga River Lake Hiking Kayaking,Shoes,shoes,Title,Default Title
vifuur-water-sports-shoes-barefoot-quick-dry-aqua-yoga-socks-slip-on-for-men-women,VIFUUR Water Sports Shoes Barefoot Quick-Dry Aqua Yoga Socks Slip-on for Men Women,Shoes,shoes,Title,Default Title
clarks-women-s-breeze-sea-flip-flop,Clarks Women's Breeze Sea Flip-Flop,Shoes,shoes,Title,Default Title
everfoams-womens-fuzzy-open-toe-slippers-soft-comfy-memory-foam-indoor-house-shoes,EverFoams Womens Fuzzy Open-toe Slippers Soft Comfy Memory Foam Indoor House Shoes,Shoes,shoes,Title,Default Title
odoly-unisex-cork-footbed-slide-sandal-arch-support-summer-outdoor-sandals-with-adjustable-buckle-for-women-and-men,"ODOLY Unisex Cork Footbed Slide Sandal, Arch Support Summer Outdoor Sandals with Adjustable Buckle for Women and Men",Shoes,shoes,Title,Default Title
cushionaire-luna-sandals-for-women-cork-footbed-womens-sandals-for-summer-comfort-with-adjustable-straps-wide-width-available,"CUSHIONAIRE Luna Sandals for Women, Cork Footbed Womens Sandals for Summer Comfort with Adjustable Straps, Wide Width Available",Shoes,shoes,Title,Default Title
whitin-slippers-for-women-non-slip-cushioned-thick-sole-slides-quick-drying-bathroom-sandals,WHITIN Slippers for Women Non Slip | Cushioned Thick Sole Slides | Quick Drying Bathroom Sandals,Shoes,shoes,Title,Default Title
oofos-ooahh-recovery-slide-women-s-and-men-s,OOFOS OOahh Recovery Slide - Women’s and Men’s,Shoes,shoes,Title,Default Title
shevalues-slim-flip-flops-for-women-beach-rubber-shower-shoes-basic-thong-sandals,shevalues Slim Flip Flops for Women Beach Rubber Shower Shoes Basic Thong Sandals,Shoes,shoes,Title,Default Title
ubfen-water-shoes-for-men-women-quick-dry-swim-aqua-socks-lightweight-barefoot-style-fit-rubber-sole-hiking-fishing-kayaking-beach-pool-boating-diving-and-water-to-land-wear,"UBFEN Water Shoes for Men Women Quick Dry Swim Aqua Socks | Lightweight Barefoot-style Fit, Rubber Sole, Hiking, Fishing, Kayaking, Beach, Pool, Boating, Diving And Water-to-land Wear",Shoes,shoes,Title,Default Title
simari-water-shoes-for-women-men-barefoot-quick-dry-aqua-socks-lightweight-swim-shoes-for-surfing-swimming-beach-sports-kayaking-diving-non-slip-design,"SIMARI Water Shoes for Women Men - Barefoot Quick-Dry Aqua Socks | Lightweight Swim Shoes for Surfing, Swimming, Beach Sports, Kayaking, Diving | Non-Slip Design",Shoes,shoes,Title,Default Title
joomra-pillow-slippers-for-women-and-men-non-slip-quick-drying-shower-slides-bathroom-sandals-ultra-cushion-thick-sole,Joomra Pillow Slippers for Women and Men Non Slip Quick Drying Shower Slides Bathroom Sandals | Ultra Cushion | Thick Sole,Shoes,shoes,Title,Default Title
whitin-women-s-multi-purpose-feather-water-shoes-thick-sole,WHITIN Women's Multi-Purpose Feather Water Shoes + Thick Sole,Shoes,shoes,Title,Default Title
brooks-women-s-ghost-max-3-neutral-running-walking-shoe,Brooks Women’s Ghost Max 3 Neutral Running & Walking Shoe,Shoes,shoes,Title,Default Title
cushionaire-splash-jelly-flip-flops-for-women-with-flexible-sole-soft-footbed-summer-sandals-for-women,"CUSHIONAIRE Splash Jelly Flip Flops for Women With Flexible Sole, Soft Footbed Summer Sandals for Women",Shoes,shoes,Title,Default Title
goosecret-women-s-comfortable-arch-support-walking-platform-sandals-lightweight-chunky-slip-on-foam-slides-with-adjustable-buckle-sandals-for-beach-and-daily-wear,"Goosecret Women's Comfortable Arch Support Walking Platform Sandals | Lightweight Chunky Slip-On Foam Slides with Adjustable Buckle, Sandals for Beach and Daily Wear",Shoes,shoes,Title,Default Title
skechers-women-s-hands-free-slip-ins-go-walk-flex-grand-entry-sneaker,Skechers Women's Hands Free Slip-ins Go Walk Flex - Grand Entry Sneaker,Shoes,shoes,Title,Default Title
hisea-rollda-cowboy-boots-for-women-cowgirl-boots-comfortable-western-boots-with-pointed-toe-stitched-embroidery-for-country-concert-dancing-wedding-traveling-daily-outfits,"HISEA Rollda Cowboy Boots for Women, Cowgirl Boots, Comfortable Western Boots with Pointed Toe Stitched Embroidery for Country Concert Dancing Wedding Traveling Daily Outfits",Shoes,shoes,Title,Default Title
yalox-water-shoes-women-s-men-s-outdoor-beach-swimming-aqua-socks-quick-dry-barefoot-shoes-surfing-yoga-pool-exercise,YALOX Water Shoes Women's Men's Outdoor Beach Swimming Aqua Socks Quick-Dry Barefoot Shoes Surfing Yoga Pool Exercise,Shoes,shoes,Title,Default Title
kuailu-womens-flip-flops-ladies-yoga-mat-comfortable-walking-thong-sandals-with-plantar-fasciitis-arch-support-slip-on-indoor-outdoor-for-summer,KuaiLu Womens Flip Flops Ladies Yoga Mat Comfortable Walking Thong Sandals With Plantar Fasciitis Arch Support Slip On Indoor Outdoor For Summer,Shoes,shoes,Title,Default Title
cushionaire-feather-eva-slides-for-women-comfortable-slip-on-womens-slippers-indoor-outdoor-shower-shoes-beach-essential-cloud-slides,"CUSHIONAIRE Feather EVA Slides for Women – Comfortable Slip On Womens Slippers, Indoor Outdoor Shower Shoes, Beach Essential Cloud Slides",Shoes,shoes,Title,Default Title
new-balance-women-s-327-sneaker,New Balance Women's 327 Sneaker,Shoes,shoes,Title,Default Title
kuailu-womens-fashion-orthotic-slides-ladies-athletic-yoga-mat-memory-foam-walking-sandals-thick-cushion-recovery-summer-beach-slippers-comfortable-plantar-fasciitis-arch-support,KuaiLu Womens Fashion Orthotic Slides Ladies Athletic Yoga Mat Memory Foam Walking Sandals Thick Cushion Recovery Summer Beach Slippers Comfortable Plantar Fasciitis Arch Support,Shoes,shoes,Title,Default Title
new-balance-women-s-608-v5-casual-comfort-cross-trainer,New Balance Women's 608 V5 Casual Comfort Cross Trainer,Shoes,shoes,Title,Default Title
kidmi-unisex-summer-sandals-arch-support-cork-footbed-slide-sandals-with-double-adjustable-buckle-for-women-men,KIDMI Unisex Summer Sandals Arch Support Cork Footbed Slide Sandals with Double Adjustable Buckle for Women Men,Shoes,shoes,Title,Default Title
adidas-womens-vl-court-3-0,adidas Womens Vl Court 3.0,Shoes,shoes,Title,Default Title
brooks-women-s-ghost-17-neutral-running-shoe,Brooks Women’s Ghost 17 Neutral Running Shoe,Shoes,shoes,Title,Default Title
reef-women-s-cushion-breeze-flip-flops,REEF Women's Cushion Breeze Flip Flops,Shoes,shoes,Title,Default Title
reef-cushion-vista-hi-womens-platform-fashion-sandal-arch-support-ultra-soft-cushion-footbed,"Reef Cushion Vista Hi Womens Platform Fashion Sandal, Arch Support, Ultra Soft Cushion Footbed",Shoes,shoes,Title,Default Title
reef-womens-bliss-nights-flip-flop,REEF Womens Bliss Nights Flip Flop,Shoes,shoes,Title,Default Title
cushionaire-fame-pillow-recovery-sandals-for-women-adjustable-double-buckle-waterproof-eva-cloud-slides-for-women,"CUSHIONAIRE Fame Pillow Recovery Sandals for Women, Adjustable Double Buckle Waterproof EVA Cloud Slides for Women",Shoes,shoes,Title,Default Title
watelves-womens-barefoot-water-shoes-travel-house-slippers-for-indoor-and-outdoor-aqua-socks-for-beach-swim-surf-yoga-dancing-camping-must-haves,WateLves Womens Barefoot Water Shoes Travel House Slippers for Indoor and Outdoor Aqua Socks for Beach Swim Surf Yoga Dancing Camping Must Haves,Shoes,shoes,Title,Default Title
reef-cushion-vista-womens-sandal,REEF Cushion Vista Womens Sandal,Shoes,shoes,Title,Default Title
doussprt-women-s-water-shoes-quick-drying-sports-aqua-shoes,DOUSSPRT Women's Water Shoes Quick Drying Sports Aqua Shoes,Shoes,shoes,Title,Default Title
anluke-water-shoes-barefoot-aqua-yoga-socks-quick-dry-beach-swim-surf-shoes-for-women-men,ANLUKE Water Shoes Barefoot Aqua Yoga Socks Quick-Dry Beach Swim Surf Shoes for Women Men,Shoes,shoes,Title,Default Title
